{
  "version": "0.1.0",
  "name": "LEVER Capability Framework",
  "description": "LEVER (Learn, Execute, Value, Enable, Replicate) is a capability multiplication framework that synthesizes classical learning models (Bloom's Taxonomy, Dreyfus Model, Shu-Ha-Ri, Apprenticeship) for the AI era. It describes how individuals progress from acquiring knowledge to creating value, enabling others, and ultimately replicating capability through systems, automation, AI agents, platforms, and institutions.",
  "stages": [
    {
      "id": "learn",
      "name": "Learn",
      "order": 1,
      "question": "What do I know?",
      "output": "Knowledge",
      "description": "Acquire knowledge through study, observation, and instruction. Build vocabulary, concepts, and mental models. This is the foundation of all capability development.",
      "characteristics": [
        "Studies concepts and terminology",
        "Follows instructions and tutorials",
        "Asks questions to understand",
        "Builds foundational mental models"
      ]
    },
    {
      "id": "execute",
      "name": "Execute",
      "order": 2,
      "question": "What can I do?",
      "output": "Results",
      "description": "Apply knowledge to produce work. Move from theory to practice. Requires guidance and supervision but can complete defined tasks.",
      "characteristics": [
        "Completes assigned tasks",
        "Applies learned techniques",
        "Requires supervision and guidance",
        "Produces work product with support"
      ]
    },
    {
      "id": "value",
      "name": "Value",
      "order": 3,
      "question": "Can I independently create outcomes?",
      "output": "Measurable outcomes",
      "description": "Demonstrate independent ability to create value. Operate without supervision. Make decisions and own results. This is where practitioners become trusted contributors.",
      "characteristics": [
        "Works independently",
        "Makes sound decisions",
        "Delivers measurable outcomes",
        "Earns trust through results",
        "Solves problems autonomously"
      ]
    },
    {
      "id": "enable",
      "name": "Enable",
      "order": 4,
      "question": "Can I make others successful?",
      "output": "Capable people",
      "description": "Develop other people's capabilities. Mentor, coach, teach, and lead. Output shifts from personal work to growing others. This is where practitioners become leaders.",
      "characteristics": [
        "Mentors and coaches others",
        "Teaches effectively",
        "Builds team capability",
        "Multiplies impact through people",
        "Creates psychological safety"
      ]
    },
    {
      "id": "replicate",
      "name": "Replicate",
      "order": 5,
      "question": "Can I make success repeatable at scale?",
      "output": "Systems",
      "description": "Create systems that multiply capability beyond direct human interaction. Build platforms, standards, frameworks, AI agents, automation, and institutions that enable many others to succeed. This is the AI-era extension of classical mastery models.",
      "characteristics": [
        "Creates reusable frameworks",
        "Builds platforms and tools",
        "Defines standards and best practices",
        "Develops AI agents and automation",
        "Establishes institutions and communities",
        "Scales impact through systems"
      ]
    }
  ],
  "frameworks": [
    {
      "id": "bloom",
      "name": "Bloom's Taxonomy",
      "description": "A hierarchical model of cognitive learning objectives widely used in education.",
      "origin": "Benjamin Bloom, 1956 (revised 2001)",
      "primary_focus": "Cognitive mastery levels",
      "stages": [
        {
          "id": "remember",
          "name": "Remember",
          "order": 1,
          "description": "Recall facts and basic concepts"
        },
        {
          "id": "understand",
          "name": "Understand",
          "order": 2,
          "description": "Explain ideas or concepts"
        },
        {
          "id": "apply",
          "name": "Apply",
          "order": 3,
          "description": "Use information in new situations"
        },
        {
          "id": "analyze",
          "name": "Analyze",
          "order": 4,
          "description": "Draw connections among ideas"
        },
        {
          "id": "evaluate",
          "name": "Evaluate",
          "order": 5,
          "description": "Justify a decision or course of action"
        },
        {
          "id": "create",
          "name": "Create",
          "order": 6,
          "description": "Produce new or original work"
        }
      ]
    },
    {
      "id": "dreyfus",
      "name": "Dreyfus Model of Skill Acquisition",
      "description": "A model describing how students acquire skills through formal instruction and practice.",
      "origin": "Stuart and Hubert Dreyfus, 1980",
      "primary_focus": "Skill acquisition and independence",
      "stages": [
        {
          "id": "novice",
          "name": "Novice",
          "order": 1,
          "description": "Follows rules exactly, requires explicit instructions"
        },
        {
          "id": "advanced-beginner",
          "name": "Advanced Beginner",
          "order": 2,
          "description": "Recognizes patterns from experience"
        },
        {
          "id": "competent",
          "name": "Competent",
          "order": 3,
          "description": "Plans and prioritizes, manages complexity"
        },
        {
          "id": "proficient",
          "name": "Proficient",
          "order": 4,
          "description": "Sees situations holistically, knows what matters"
        },
        {
          "id": "expert",
          "name": "Expert",
          "order": 5,
          "description": "Operates intuitively, transcends rules"
        }
      ]
    },
    {
      "id": "shu-ha-ri",
      "name": "Shu-Ha-Ri",
      "description": "A Japanese martial arts concept describing stages of learning to mastery.",
      "origin": "Japanese martial arts tradition, popularized by Alistair Cockburn in software",
      "primary_focus": "Relationship to rules and tradition",
      "stages": [
        {
          "id": "shu",
          "name": "Shu (守)",
          "order": 1,
          "description": "Obey - Follow the rules exactly, learn the forms"
        },
        {
          "id": "ha",
          "name": "Ha (破)",
          "order": 2,
          "description": "Detach - Break from tradition, understand when rules bend"
        },
        {
          "id": "ri",
          "name": "Ri (離)",
          "order": 3,
          "description": "Transcend - Create your own approach, rules become instinct"
        }
      ]
    },
    {
      "id": "apprenticeship",
      "name": "Apprenticeship Model",
      "description": "The traditional craft-based progression from apprentice to master.",
      "origin": "Medieval guild system, formalized craft traditions",
      "primary_focus": "Responsibility and teaching progression",
      "stages": [
        {
          "id": "observe",
          "name": "Observe",
          "order": 1,
          "description": "Watch experts perform the craft"
        },
        {
          "id": "assist",
          "name": "Assist",
          "order": 2,
          "description": "Help experts with supervised tasks"
        },
        {
          "id": "perform",
          "name": "Perform",
          "order": 3,
          "description": "Work independently on full tasks"
        },
        {
          "id": "lead",
          "name": "Lead",
          "order": 4,
          "description": "Guide others, take responsibility for outcomes"
        },
        {
          "id": "teach",
          "name": "Teach",
          "order": 5,
          "description": "Train apprentices, preserve and advance the craft"
        }
      ]
    },
    {
      "id": "conscious-competence",
      "name": "Conscious Competence Model",
      "description": "A model describing the psychological states in learning a new skill.",
      "origin": "Noel Burch, Gordon Training International, 1970s",
      "primary_focus": "Awareness of own competence",
      "stages": [
        {
          "id": "unconscious-incompetence",
          "name": "Unconscious Incompetence",
          "order": 1,
          "description": "Don't know what you don't know"
        },
        {
          "id": "conscious-incompetence",
          "name": "Conscious Incompetence",
          "order": 2,
          "description": "Aware of skill gap, learning begins"
        },
        {
          "id": "conscious-competence",
          "name": "Conscious Competence",
          "order": 3,
          "description": "Can perform with deliberate effort"
        },
        {
          "id": "unconscious-competence",
          "name": "Unconscious Competence",
          "order": 4,
          "description": "Skill becomes automatic"
        }
      ]
    }
  ],
  "mappings": [
    {
      "framework_id": "bloom",
      "mappings": [
        {
          "lever_stage": "learn",
          "framework_id": "bloom",
          "framework_stages": [
            "remember",
            "understand"
          ],
          "notes": "Knowledge acquisition covers basic recall and comprehension"
        },
        {
          "lever_stage": "execute",
          "framework_id": "bloom",
          "framework_stages": [
            "apply"
          ],
          "notes": "Execution is the application of learned knowledge"
        },
        {
          "lever_stage": "value",
          "framework_id": "bloom",
          "framework_stages": [
            "analyze",
            "evaluate"
          ],
          "notes": "Creating value requires analysis and judgment"
        },
        {
          "lever_stage": "enable",
          "framework_id": "bloom",
          "framework_stages": [
            "create"
          ],